{
  "record_id": "explanation-g14-w001-external-generalization-gap-20260729",
  "record_type": "explanation",
  "created_at": "2026-07-29T13:20:02+00:00",
  "source_refs": [
    "result:W001-A003-result-R004",
    "result:W001-A004-result-R002",
    "contract:df0c5df369a3049125d06b985683c7bf7c4027664fc48d8b86f103e0ad8044e5",
    "user_confirmation:G14-3"
  ],
  "experiment_id": "mpp2_huber_loss_paired_v001_20260728",
  "result_id": "W001-A004-result-R002",
  "payload": {
    "observation": "external XZY mean-per-pathway R2为MSE=-0.0880167、Huber=-0.0900913；预测CSV没有样本或空间簇ID。",
    "interpretation": "两臂均存在外部泛化不足；当前证据能确定主门控差值，却不能完成预注册的空间簇不确定性量化。",
    "recommendation": "将空间簇bootstrap可审计输入和外部负R2的改进路径留为开放问题；任何后续训练或评估扩展均需独立批准。",
    "unit": "external XZY，30 pathways，1039 samples",
    "statistic": "pooled PCC delta=-0.0022051561；mean-per-pathway R2: -0.0880167 versus -0.0900913",
    "text_description": "此记录不把未运行的bootstrap或描述性通路计数视作门控通过证据。"
  }
}
